17:59:27.935870 IP localhost.56118 > localhost.1025: Flags [S], seq 3696333416, win 43690, options [mss 65495,sackOK,TS val 3535511283 ecr 0,nop,wscale 7], length 0
17:59:27.935919 IP localhost.1025 > localhost.56118: Flags [S.], seq 2772787666, ack 3696333417, win 43690, options [mss 65495,sackOK,TS val 3535511283 ecr 3535511283,nop,wscale 7], length 0
17:59:27.935956 IP localhost.56118 > localhost.1025: Flags [.], ack 1, win 342, options [nop,nop,TS val 3535511283 ecr 3535511283], length 0
17:59:27.936605 IP localhost.1025 > localhost.56118: Flags [P.], seq 1:36, ack 1, win 342, options [nop,nop,TS val 3535511284 ecr 3535511283], length 35
17:59:27.936646 IP localhost.56118 > localhost.1025: Flags [.], ack 36, win 342, options [nop,nop,TS val 3535511284 ecr 3535511284], length 0
17:59:27.936797 IP localhost.56118 > localhost.1025: Flags [P.], seq 1:17, ack 36, win 342, options [nop,nop,TS val 3535511284 ecr 3535511284], length 16
17:59:27.936813 IP localhost.1025 > localhost.56118: Flags [.], ack 17, win 342, options [nop,nop,TS val 3535511284 ecr 3535511284], length 0
17:59:27.938117 IP localhost.1025 > localhost.56118: Flags [P.], seq 36:57, ack 17, win 342, options [nop,nop,TS val 3535511285 ecr 3535511284], length 21
17:59:27.938785 IP localhost.1025 > localhost.56118: Flags [P.], seq 57:73, ack 17, win 342, options [nop,nop,TS val 3535511286 ecr 3535511284], length 16
17:59:27.938866 IP localhost.56118 > localhost.1025: Flags [.], ack 73, win 342, options [nop,nop,TS val 3535511286 ecr 3535511285], length 0
17:59:27.939297 IP localhost.1025 > localhost.56118: Flags [P.], seq 73:89, ack 17, win 342, options [nop,nop,TS val 3535511286 ecr 3535511286], length 16
17:59:27.939418 IP localhost.56118 > localhost.1025: Flags [P.], seq 17:52, ack 89, win 342, options [nop,nop,TS val 3535511286 ecr 3535511286], length 35
17:59:27.940810 IP localhost.1025 > localhost.56118: Flags [P.], seq 89:126, ack 52, win 342, options [nop,nop,TS val 3535511288 ecr 3535511286], length 37
17:59:27.940915 IP localhost.56118 > localhost.1025: Flags [P.], seq 52:85, ack 126, win 342, options [nop,nop,TS val 3535511288 ecr 3535511288], length 33
17:59:27.942697 IP localhost.1025 > localhost.56118: Flags [P.], seq 126:166, ack 85, win 342, options [nop,nop,TS val 3535511290 ecr 3535511288], length 40
17:59:27.942793 IP localhost.56118 > localhost.1025: Flags [P.], seq 85:91, ack 166, win 342, options [nop,nop,TS val 3535511290 ecr 3535511290], length 6
17:59:27.944097 IP localhost.1025 > localhost.56118: Flags [P.], seq 166:203, ack 91, win 342, options [nop,nop,TS val 3535511291 ecr 3535511290], length 37
17:59:27.944220 IP localhost.56118 > localhost.1025: Flags [P.], seq 91:119, ack 203, win 342, options [nop,nop,TS val 3535511291 ecr 3535511291], length 28
17:59:27.944283 IP localhost.56118 > localhost.1025: Flags [P.], seq 119:125, ack 203, win 342, options [nop,nop,TS val 3535511291 ecr 3535511291], length 6
17:59:27.944984 IP localhost.1025 > localhost.56118: Flags [.], ack 125, win 342, options [nop,nop,TS val 3535511291 ecr 3535511291], length 0
17:59:27.957017 IP localhost.1025 > localhost.56118: Flags [P.], seq 203:283, ack 125, win 342, options [nop,nop,TS val 3535511304 ecr 3535511291], length 80
17:59:27.958718 IP localhost.1025 > localhost.56118: Flags [P.], seq 283:292, ack 125, win 342, options [nop,nop,TS val 3535511306 ecr 3535511291], length 9
17:59:27.959011 IP localhost.1025 > localhost.56118: Flags [F.], seq 292, ack 125, win 342, options [nop,nop,TS val 3535511306 ecr 3535511291], length 0
17:59:27.974469 IP localhost.1025 > localhost.56118: Flags [F.], seq 292, ack 125, win 342, options [nop,nop,TS val 3535511321 ecr 3535511291], length 0
17:59:27.974491 IP localhost.56118 > localhost.1025: Flags [.], ack 293, win 342, options [nop,nop,TS val 3535511322 ecr 3535511304,nop,nop,sack 1 {292:293}], length 0
17:59:28.157404 IP localhost.56120 > localhost.1025: Flags [S], seq 2863597202, win 43690, options [mss 65495,sackOK,TS val 3535511504 ecr 0,nop,wscale 7], length 0
17:59:28.157444 IP localhost.1025 > localhost.56120: Flags [S.], seq 415376961, ack 2863597203, win 43690, options [mss 65495,sackOK,TS val 3535511504 ecr 3535511504,nop,wscale 7], length 0
17:59:28.157476 IP localhost.56120 > localhost.1025: Flags [.], ack 1, win 342, options [nop,nop,TS val 3535511505 ecr 3535511504], length 0
17:59:28.158006 IP localhost.1025 > localhost.56120: Flags [P.], seq 1:36, ack 1, win 342, options [nop,nop,TS val 3535511505 ecr 3535511505], length 35
17:59:28.158050 IP localhost.56120 > localhost.1025: Flags [.], ack 36, win 342, options [nop,nop,TS val 3535511505 ecr 3535511505], length 0
17:59:28.158229 IP localhost.56120 > localhost.1025: Flags [P.], seq 1:17, ack 36, win 342, options [nop,nop,TS val 3535511505 ecr 3535511505], length 16
17:59:28.158248 IP localhost.1025 > localhost.56120: Flags [.], ack 17, win 342, options [nop,nop,TS val 3535511505 ecr 3535511505], length 0
17:59:28.158761 IP localhost.1025 > localhost.56120: Flags [P.], seq 36:57, ack 17, win 342, options [nop,nop,TS val 3535511506 ecr 3535511505], length 21
17:59:28.158833 IP localhost.1025 > localhost.56120: Flags [P.], seq 57:73, ack 17, win 342, options [nop,nop,TS val 3535511506 ecr 3535511505], length 16
17:59:28.158875 IP localhost.56120 > localhost.1025: Flags [.], ack 73, win 342, options [nop,nop,TS val 3535511506 ecr 3535511506], length 0
17:59:28.158885 IP localhost.1025 > localhost.56120: Flags [P.], seq 73:89, ack 17, win 342, options [nop,nop,TS val 3535511506 ecr 3535511505], length 16
17:59:28.158978 IP localhost.56120 > localhost.1025: Flags [P.], seq 17:52, ack 89, win 342, options [nop,nop,TS val 3535511506 ecr 3535511506], length 35
17:59:28.159253 IP localhost.1025 > localhost.56120: Flags [P.], seq 89:126, ack 52, win 342, options [nop,nop,TS val 3535511506 ecr 3535511506], length 37
17:59:28.159359 IP localhost.56120 > localhost.1025: Flags [P.], seq 52:85, ack 126, win 342, options [nop,nop,TS val 3535511506 ecr 3535511506], length 33
17:59:28.159662 IP localhost.1025 > localhost.56120: Flags [P.], seq 126:166, ack 85, win 342, options [nop,nop,TS val 3535511507 ecr 3535511506], length 40
17:59:28.159760 IP localhost.56120 > localhost.1025: Flags [P.], seq 85:91, ack 166, win 342, options [nop,nop,TS val 3535511507 ecr 3535511507], length 6
17:59:28.159968 IP localhost.1025 > localhost.56120: Flags [P.], seq 166:203, ack 91, win 342, options [nop,nop,TS val 3535511507 ecr 3535511507], length 37
17:59:28.160244 IP localhost.56120 > localhost.1025: Flags [P.], seq 91:119, ack 203, win 342, options [nop,nop,TS val 3535511507 ecr 3535511507], length 28
17:59:28.160294 IP localhost.56120 > localhost.1025: Flags [P.], seq 119:125, ack 203, win 342, options [nop,nop,TS val 3535511507 ecr 3535511507], length 6
17:59:28.160510 IP localhost.1025 > localhost.56120: Flags [P.], seq 203:283, ack 125, win 342, options [nop,nop,TS val 3535511508 ecr 3535511507], length 80
17:59:28.160689 IP localhost.1025 > localhost.56120: Flags [P.], seq 283:292, ack 125, win 342, options [nop,nop,TS val 3535511508 ecr 3535511507], length 9
17:59:28.160735 IP localhost.1025 > localhost.56120: Flags [F.], seq 292, ack 125, win 342, options [nop,nop,TS val 3535511508 ecr 3535511507], length 0
17:59:28.174458 IP localhost.1025 > localhost.56120: Flags [F.], seq 292, ack 125, win 342, options [nop,nop,TS val 3535511521 ecr 3535511507], length 0
17:59:28.174488 IP localhost.56120 > localhost.1025: Flags [.], ack 293, win 342, options [nop,nop,TS val 3535511522 ecr 3535511508,nop,nop,sack 1 {292:293}], length 0
17:59:28.360861 IP localhost.56122 > localhost.1025: Flags [S], seq 1949196370, win 43690, options [mss 65495,sackOK,TS val 3535511708 ecr 0,nop,wscale 7], length 0
17:59:28.360901 IP localhost.1025 > localhost.56122: Flags [S.], seq 1388781165, ack 1949196371, win 43690, options [mss 65495,sackOK,TS val 3535511708 ecr 3535511708,nop,wscale 7], length 0
17:59:28.360935 IP localhost.56122 > localhost.1025: Flags [.], ack 1, win 342, options [nop,nop,TS val 3535511708 ecr 3535511708], length 0
17:59:28.361508 IP localhost.1025 > localhost.56122: Flags [P.], seq 1:36, ack 1, win 342, options [nop,nop,TS val 3535511709 ecr 3535511708], length 35
17:59:28.361551 IP localhost.56122 > localhost.1025: Flags [.], ack 36, win 342, options [nop,nop,TS val 3535511709 ecr 3535511709], length 0
17:59:28.361655 IP localhost.56122 > localhost.1025: Flags [P.], seq 1:17, ack 36, win 342, options [nop,nop,TS val 3535511709 ecr 3535511709], length 16
17:59:28.361681 IP localhost.1025 > localhost.56122: Flags [.], ack 17, win 342, options [nop,nop,TS val 3535511709 ecr 3535511709], length 0
17:59:28.362065 IP localhost.1025 > localhost.56122: Flags [P.], seq 36:57, ack 17, win 342, options [nop,nop,TS val 3535511709 ecr 3535511709], length 21
17:59:28.362167 IP localhost.1025 > localhost.56122: Flags [P.], seq 57:73, ack 17, win 342, options [nop,nop,TS val 3535511709 ecr 3535511709], length 16
17:59:28.362228 IP localhost.56122 > localhost.1025: Flags [.], ack 73, win 342, options [nop,nop,TS val 3535511709 ecr 3535511709], length 0
17:59:28.362255 IP localhost.1025 > localhost.56122: Flags [P.], seq 73:89, ack 17, win 342, options [nop,nop,TS val 3535511709 ecr 3535511709], length 16
17:59:28.362348 IP localhost.56122 > localhost.1025: Flags [P.], seq 17:52, ack 89, win 342, options [nop,nop,TS val 3535511709 ecr 3535511709], length 35
17:59:28.362686 IP localhost.1025 > localhost.56122: Flags [P.], seq 89:126, ack 52, win 342, options [nop,nop,TS val 3535511710 ecr 3535511709], length 37
17:59:28.362806 IP localhost.56122 > localhost.1025: Flags [P.], seq 52:85, ack 126, win 342, options [nop,nop,TS val 3535511710 ecr 3535511710], length 33
17:59:28.363106 IP localhost.1025 > localhost.56122: Flags [P.], seq 126:166, ack 85, win 342, options [nop,nop,TS val 3535511710 ecr 3535511710], length 40
17:59:28.363219 IP localhost.56122 > localhost.1025: Flags [P.], seq 85:91, ack 166, win 342, options [nop,nop,TS val 3535511710 ecr 3535511710], length 6
17:59:28.363523 IP localhost.1025 > localhost.56122: Flags [P.], seq 166:203, ack 91, win 342, options [nop,nop,TS val 3535511711 ecr 3535511710], length 37
17:59:28.363624 IP localhost.56122 > localhost.1025: Flags [P.], seq 91:119, ack 203, win 342, options [nop,nop,TS val 3535511711 ecr 3535511711], length 28
17:59:28.363676 IP localhost.56122 > localhost.1025: Flags [P.], seq 119:125, ack 203, win 342, options [nop,nop,TS val 3535511711 ecr 3535511711], length 6
17:59:28.363957 IP localhost.1025 > localhost.56122: Flags [P.], seq 203:283, ack 125, win 342, options [nop,nop,TS val 3535511711 ecr 3535511711], length 80
17:59:28.364324 IP localhost.1025 > localhost.56122: Flags [P.], seq 283:292, ack 125, win 342, options [nop,nop,TS val 3535511711 ecr 3535511711], length 9
17:59:28.364383 IP localhost.1025 > localhost.56122: Flags [F.], seq 292, ack 125, win 342, options [nop,nop,TS val 3535511711 ecr 3535511711], length 0
17:59:28.378455 IP localhost.1025 > localhost.56122: Flags [F.], seq 292, ack 125, win 342, options [nop,nop,TS val 3535511725 ecr 3535511711], length 0
17:59:28.378491 IP localhost.56122 > localhost.1025: Flags [.], ack 293, win 342, options [nop,nop,TS val 3535511726 ecr 3535511711,nop,nop,sack 1 {292:293}], length 0
17:59:28.564388 IP localhost.56124 > localhost.1025: Flags [S], seq 2346498398, win 43690, options [mss 65495,sackOK,TS val 3535511911 ecr 0,nop,wscale 7], length 0
17:59:28.564431 IP localhost.1025 > localhost.56124: Flags [S.], seq 973574435, ack 2346498399, win 43690, options [mss 65495,sackOK,TS val 3535511911 ecr 3535511911,nop,wscale 7], length 0
17:59:28.564473 IP localhost.56124 > localhost.1025: Flags [.], ack 1, win 342, options [nop,nop,TS val 3535511912 ecr 3535511911], length 0
17:59:28.565277 IP localhost.1025 > localhost.56124: Flags [P.], seq 1:36, ack 1, win 342, options [nop,nop,TS val 3535511912 ecr 3535511912], length 35
17:59:28.565321 IP localhost.56124 > localhost.1025: Flags [.], ack 36, win 342, options [nop,nop,TS val 3535511912 ecr 3535511912], length 0
17:59:28.565443 IP localhost.56124 > localhost.1025: Flags [P.], seq 1:17, ack 36, win 342, options [nop,nop,TS val 3535511912 ecr 3535511912], length 16
17:59:28.565469 IP localhost.1025 > localhost.56124: Flags [.], ack 17, win 342, options [nop,nop,TS val 3535511913 ecr 3535511912], length 0
17:59:28.565894 IP localhost.1025 > localhost.56124: Flags [P.], seq 36:57, ack 17, win 342, options [nop,nop,TS val 3535511913 ecr 3535511912], length 21
17:59:28.565993 IP localhost.1025 > localhost.56124: Flags [P.], seq 57:73, ack 17, win 342, options [nop,nop,TS val 3535511913 ecr 3535511912], length 16
17:59:28.566071 IP localhost.1025 > localhost.56124: Flags [P.], seq 73:89, ack 17, win 342, options [nop,nop,TS val 3535511913 ecr 3535511912], length 16
17:59:28.566221 IP localhost.56124 > localhost.1025: Flags [.], ack 89, win 342, options [nop,nop,TS val 3535511913 ecr 3535511913], length 0
17:59:28.566318 IP localhost.56124 > localhost.1025: Flags [P.], seq 17:52, ack 89, win 342, options [nop,nop,TS val 3535511913 ecr 3535511913], length 35
17:59:28.566870 IP localhost.1025 > localhost.56124: Flags [P.], seq 89:126, ack 52, win 342, options [nop,nop,TS val 3535511914 ecr 3535511913], length 37
17:59:28.567041 IP localhost.56124 > localhost.1025: Flags [P.], seq 52:85, ack 126, win 342, options [nop,nop,TS val 3535511914 ecr 3535511914], length 33
17:59:28.567391 IP localhost.1025 > localhost.56124: Flags [P.], seq 126:166, ack 85, win 342, options [nop,nop,TS val 3535511914 ecr 3535511914], length 40
17:59:28.567513 IP localhost.56124 > localhost.1025: Flags [P.], seq 85:91, ack 166, win 342, options [nop,nop,TS val 3535511915 ecr 3535511914], length 6
17:59:28.567807 IP localhost.1025 > localhost.56124: Flags [P.], seq 166:203, ack 91, win 342, options [nop,nop,TS val 3535511915 ecr 3535511915], length 37
17:59:28.567935 IP localhost.56124 > localhost.1025: Flags [P.], seq 91:119, ack 203, win 342, options [nop,nop,TS val 3535511915 ecr 3535511915], length 28
17:59:28.567994 IP localhost.56124 > localhost.1025: Flags [P.], seq 119:125, ack 203, win 342, options [nop,nop,TS val 3535511915 ecr 3535511915], length 6
17:59:28.568307 IP localhost.1025 > localhost.56124: Flags [P.], seq 203:283, ack 125, win 342, options [nop,nop,TS val 3535511915 ecr 3535511915], length 80
17:59:28.568603 IP localhost.1025 > localhost.56124: Flags [P.], seq 283:292, ack 125, win 342, options [nop,nop,TS val 3535511916 ecr 3535511915], length 9
17:59:28.568674 IP localhost.1025 > localhost.56124: Flags [F.], seq 292, ack 125, win 342, options [nop,nop,TS val 3535511916 ecr 3535511915], length 0
17:59:28.582460 IP localhost.1025 > localhost.56124: Flags [F.], seq 292, ack 125, win 342, options [nop,nop,TS val 3535511929 ecr 3535511915], length 0
17:59:28.582489 IP localhost.56124 > localhost.1025: Flags [.], ack 293, win 342, options [nop,nop,TS val 3535511930 ecr 3535511915,nop,nop,sack 1 {292:293}], length 0
17:59:28.768660 IP localhost.56126 > localhost.1025: Flags [S], seq 4176527250, win 43690, options [mss 65495,sackOK,TS val 3535512116 ecr 0,nop,wscale 7], length 0
17:59:28.768689 IP localhost.1025 > localhost.56126: Flags [S.], seq 3554824682, ack 4176527251, win 43690, options [mss 65495,sackOK,TS val 3535512116 ecr 3535512116,nop,wscale 7], length 0
17:59:28.768719 IP localhost.56126 > localhost.1025: Flags [.], ack 1, win 342, options [nop,nop,TS val 3535512116 ecr 3535512116], length 0
17:59:28.769230 IP localhost.1025 > localhost.56126: Flags [P.], seq 1:36, ack 1, win 342, options [nop,nop,TS val 3535512116 ecr 3535512116], length 35
17:59:28.769250 IP localhost.56126 > localhost.1025: Flags [.], ack 36, win 342, options [nop,nop,TS val 3535512116 ecr 3535512116], length 0
17:59:28.769343 IP localhost.56126 > localhost.1025: Flags [P.], seq 1:17, ack 36, win 342, options [nop,nop,TS val 3535512116 ecr 3535512116], length 16
17:59:28.769366 IP localhost.1025 > localhost.56126: Flags [.], ack 17, win 342, options [nop,nop,TS val 3535512116 ecr 3535512116], length 0
17:59:28.769627 IP localhost.1025 > localhost.56126: Flags [P.], seq 36:57, ack 17, win 342, options [nop,nop,TS val 3535512117 ecr 3535512116], length 21
17:59:28.769687 IP localhost.1025 > localhost.56126: Flags [P.], seq 57:73, ack 17, win 342, options [nop,nop,TS val 3535512117 ecr 3535512116], length 16
17:59:28.769729 IP localhost.56126 > localhost.1025: Flags [.], ack 73, win 342, options [nop,nop,TS val 3535512117 ecr 3535512117], length 0
17:59:28.769750 IP localhost.1025 > localhost.56126: Flags [P.], seq 73:89, ack 17, win 342, options [nop,nop,TS val 3535512117 ecr 3535512116], length 16
17:59:28.769848 IP localhost.56126 > localhost.1025: Flags [P.], seq 17:52, ack 89, win 342, options [nop,nop,TS val 3535512117 ecr 3535512117], length 35
17:59:28.770078 IP localhost.1025 > localhost.56126: Flags [P.], seq 89:126, ack 52, win 342, options [nop,nop,TS val 3535512117 ecr 3535512117], length 37
17:59:28.770154 IP localhost.56126 > localhost.1025: Flags [P.], seq 52:85, ack 126, win 342, options [nop,nop,TS val 3535512117 ecr 3535512117], length 33
17:59:28.770364 IP localhost.1025 > localhost.56126: Flags [P.], seq 126:166, ack 85, win 342, options [nop,nop,TS val 3535512117 ecr 3535512117], length 40
17:59:28.770465 IP localhost.56126 > localhost.1025: Flags [P.], seq 85:91, ack 166, win 342, options [nop,nop,TS val 3535512118 ecr 3535512117], length 6
17:59:28.770707 IP localhost.1025 > localhost.56126: Flags [P.], seq 166:203, ack 91, win 342, options [nop,nop,TS val 3535512118 ecr 3535512118], length 37
17:59:28.772873 IP localhost.56126 > localhost.1025: Flags [P.], seq 91:119, ack 203, win 342, options [nop,nop,TS val 3535512120 ecr 3535512118], length 28
17:59:28.772943 IP localhost.56126 > localhost.1025: Flags [P.], seq 119:125, ack 203, win 342, options [nop,nop,TS val 3535512120 ecr 3535512118], length 6
17:59:28.775777 IP localhost.1025 > localhost.56126: Flags [.], ack 125, win 342, options [nop,nop,TS val 3535512120 ecr 3535512120], length 0
17:59:28.775996 IP localhost.1025 > localhost.56126: Flags [P.], seq 203:283, ack 125, win 342, options [nop,nop,TS val 3535512123 ecr 3535512120], length 80
17:59:28.776099 IP localhost.1025 > localhost.56126: Flags [P.], seq 283:292, ack 125, win 342, options [nop,nop,TS val 3535512123 ecr 3535512120], length 9
17:59:28.776134 IP localhost.1025 > localhost.56126: Flags [F.], seq 292, ack 125, win 342, options [nop,nop,TS val 3535512123 ecr 3535512120], length 0
17:59:28.790460 IP localhost.1025 > localhost.56126: Flags [F.], seq 292, ack 125, win 342, options [nop,nop,TS val 3535512137 ecr 3535512120], length 0
17:59:28.790485 IP localhost.56126 > localhost.1025: Flags [.], ack 293, win 342, options [nop,nop,TS val 3535512138 ecr 3535512123,nop,nop,sack 1 {292:293}], length 0
17:59:28.976368 IP localhost.56128 > localhost.1025: Flags [S], seq 1215291244, win 43690, options [mss 65495,sackOK,TS val 3535512323 ecr 0,nop,wscale 7], length 0
17:59:28.976409 IP localhost.1025 > localhost.56128: Flags [S.], seq 3937414562, ack 1215291245, win 43690, options [mss 65495,sackOK,TS val 3535512323 ecr 3535512323,nop,wscale 7], length 0
17:59:28.976442 IP localhost.56128 > localhost.1025: Flags [.], ack 1, win 342, options [nop,nop,TS val 3535512323 ecr 3535512323], length 0
17:59:28.977017 IP localhost.1025 > localhost.56128: Flags [P.], seq 1:36, ack 1, win 342, options [nop,nop,TS val 3535512324 ecr 3535512323], length 35
17:59:28.977061 IP localhost.56128 > localhost.1025: Flags [.], ack 36, win 342, options [nop,nop,TS val 3535512324 ecr 3535512324], length 0
17:59:28.977179 IP localhost.56128 > localhost.1025: Flags [P.], seq 1:17, ack 36, win 342, options [nop,nop,TS val 3535512324 ecr 3535512324], length 16
17:59:28.977200 IP localhost.1025 > localhost.56128: Flags [.], ack 17, win 342, options [nop,nop,TS val 3535512324 ecr 3535512324], length 0
17:59:28.977561 IP localhost.1025 > localhost.56128: Flags [P.], seq 36:57, ack 17, win 342, options [nop,nop,TS val 3535512325 ecr 3535512324], length 21
17:59:28.977650 IP localhost.1025 > localhost.56128: Flags [P.], seq 57:73, ack 17, win 342, options [nop,nop,TS val 3535512325 ecr 3535512324], length 16
17:59:28.977697 IP localhost.56128 > localhost.1025: Flags [.], ack 73, win 342, options [nop,nop,TS val 3535512325 ecr 3535512325], length 0
17:59:28.977733 IP localhost.1025 > localhost.56128: Flags [P.], seq 73:89, ack 17, win 342, options [nop,nop,TS val 3535512325 ecr 3535512325], length 16
17:59:28.977825 IP localhost.56128 > localhost.1025: Flags [P.], seq 17:52, ack 89, win 342, options [nop,nop,TS val 3535512325 ecr 3535512325], length 35
17:59:28.978123 IP localhost.1025 > localhost.56128: Flags [P.], seq 89:126, ack 52, win 342, options [nop,nop,TS val 3535512325 ecr 3535512325], length 37
17:59:28.978242 IP localhost.56128 > localhost.1025: Flags [P.], seq 52:85, ack 126, win 342, options [nop,nop,TS val 3535512325 ecr 3535512325], length 33
17:59:28.978540 IP localhost.1025 > localhost.56128: Flags [P.], seq 126:166, ack 85, win 342, options [nop,nop,TS val 3535512326 ecr 3535512325], length 40
17:59:28.978635 IP localhost.56128 > localhost.1025: Flags [P.], seq 85:91, ack 166, win 342, options [nop,nop,TS val 3535512326 ecr 3535512326], length 6
17:59:28.978886 IP localhost.1025 > localhost.56128: Flags [P.], seq 166:203, ack 91, win 342, options [nop,nop,TS val 3535512326 ecr 3535512326], length 37
17:59:28.979006 IP localhost.56128 > localhost.1025: Flags [P.], seq 91:119, ack 203, win 342, options [nop,nop,TS val 3535512326 ecr 3535512326], length 28
17:59:28.979067 IP localhost.56128 > localhost.1025: Flags [P.], seq 119:125, ack 203, win 342, options [nop,nop,TS val 3535512326 ecr 3535512326], length 6
17:59:28.979329 IP localhost.1025 > localhost.56128: Flags [P.], seq 203:283, ack 125, win 342, options [nop,nop,TS val 3535512326 ecr 3535512326], length 80
17:59:28.979605 IP localhost.1025 > localhost.56128: Flags [P.], seq 283:292, ack 125, win 342, options [nop,nop,TS val 3535512327 ecr 3535512326], length 9
17:59:28.979660 IP localhost.1025 > localhost.56128: Flags [F.], seq 292, ack 125, win 342, options [nop,nop,TS val 3535512327 ecr 3535512326], length 0
17:59:28.994533 IP localhost.1025 > localhost.56128: Flags [F.], seq 292, ack 125, win 342, options [nop,nop,TS val 3535512341 ecr 3535512326], length 0
17:59:28.994595 IP localhost.56128 > localhost.1025: Flags [.], ack 293, win 342, options [nop,nop,TS val 3535512342 ecr 3535512326,nop,nop,sack 1 {292:293}], length 0
17:59:29.179733 IP localhost.56130 > localhost.1025: Flags [S], seq 4129935101, win 43690, options [mss 65495,sackOK,TS val 3535512527 ecr 0,nop,wscale 7], length 0
17:59:29.179778 IP localhost.1025 > localhost.56130: Flags [S.], seq 1858200471, ack 4129935102, win 43690, options [mss 65495,sackOK,TS val 3535512527 ecr 3535512527,nop,wscale 7], length 0
17:59:29.179809 IP localhost.56130 > localhost.1025: Flags [.], ack 1, win 342, options [nop,nop,TS val 3535512527 ecr 3535512527], length 0
17:59:29.180224 IP localhost.1025 > localhost.56130: Flags [P.], seq 1:36, ack 1, win 342, options [nop,nop,TS val 3535512527 ecr 3535512527], length 35
17:59:29.180247 IP localhost.56130 > localhost.1025: Flags [.], ack 36, win 342, options [nop,nop,TS val 3535512527 ecr 3535512527], length 0
17:59:29.180339 IP localhost.56130 > localhost.1025: Flags [P.], seq 1:17, ack 36, win 342, options [nop,nop,TS val 3535512527 ecr 3535512527], length 16
17:59:29.180355 IP localhost.1025 > localhost.56130: Flags [.], ack 17, win 342, options [nop,nop,TS val 3535512527 ecr 3535512527], length 0
17:59:29.180736 IP localhost.1025 > localhost.56130: Flags [P.], seq 36:57, ack 17, win 342, options [nop,nop,TS val 3535512528 ecr 3535512527], length 21
17:59:29.180804 IP localhost.1025 > localhost.56130: Flags [P.], seq 57:73, ack 17, win 342, options [nop,nop,TS val 3535512528 ecr 3535512527], length 16
17:59:29.180867 IP localhost.1025 > localhost.56130: Flags [P.], seq 73:89, ack 17, win 342, options [nop,nop,TS val 3535512528 ecr 3535512527], length 16
17:59:29.180965 IP localhost.56130 > localhost.1025: Flags [.], ack 89, win 342, options [nop,nop,TS val 3535512528 ecr 3535512528], length 0
17:59:29.181036 IP localhost.56130 > localhost.1025: Flags [P.], seq 17:52, ack 89, win 342, options [nop,nop,TS val 3535512528 ecr 3535512528], length 35
17:59:29.181346 IP localhost.1025 > localhost.56130: Flags [P.], seq 89:126, ack 52, win 342, options [nop,nop,TS val 3535512528 ecr 3535512528], length 37
17:59:29.181461 IP localhost.56130 > localhost.1025: Flags [P.], seq 52:85, ack 126, win 342, options [nop,nop,TS val 3535512528 ecr 3535512528], length 33
17:59:29.181948 IP localhost.1025 > localhost.56130: Flags [P.], seq 126:166, ack 85, win 342, options [nop,nop,TS val 3535512529 ecr 3535512528], length 40
17:59:29.182036 IP localhost.56130 > localhost.1025: Flags [P.], seq 85:91, ack 166, win 342, options [nop,nop,TS val 3535512529 ecr 3535512529], length 6
17:59:29.182358 IP localhost.1025 > localhost.56130: Flags [P.], seq 166:203, ack 91, win 342, options [nop,nop,TS val 3535512529 ecr 3535512529], length 37
17:59:29.182465 IP localhost.56130 > localhost.1025: Flags [P.], seq 91:119, ack 203, win 342, options [nop,nop,TS val 3535512529 ecr 3535512529], length 28
17:59:29.182496 IP localhost.56130 > localhost.1025: Flags [P.], seq 119:125, ack 203, win 342, options [nop,nop,TS val 3535512530 ecr 3535512529], length 6
17:59:29.182704 IP localhost.1025 > localhost.56130: Flags [.], ack 125, win 342, options [nop,nop,TS val 3535512530 ecr 3535512529], length 0
17:59:29.183068 IP localhost.1025 > localhost.56130: Flags [P.], seq 203:283, ack 125, win 342, options [nop,nop,TS val 3535512530 ecr 3535512529], length 80
17:59:29.184122 IP localhost.1025 > localhost.56130: Flags [P.], seq 283:292, ack 125, win 342, options [nop,nop,TS val 3535512531 ecr 3535512529], length 9
17:59:29.184200 IP localhost.1025 > localhost.56130: Flags [F.], seq 292, ack 125, win 342, options [nop,nop,TS val 3535512531 ecr 3535512529], length 0
17:59:29.198460 IP localhost.1025 > localhost.56130: Flags [F.], seq 292, ack 125, win 342, options [nop,nop,TS val 3535512545 ecr 3535512529], length 0
17:59:29.198500 IP localhost.56130 > localhost.1025: Flags [.], ack 293, win 342, options [nop,nop,TS val 3535512546 ecr 3535512530,nop,nop,sack 1 {292:293}], length 0
17:59:29.383447 IP localhost.56132 > localhost.1025: Flags [S], seq 3273438420, win 43690, options [mss 65495,sackOK,TS val 3535512730 ecr 0,nop,wscale 7], length 0
17:59:29.383500 IP localhost.1025 > localhost.56132: Flags [S.], seq 2815521671, ack 3273438421, win 43690, options [mss 65495,sackOK,TS val 3535512731 ecr 3535512730,nop,wscale 7], length 0
17:59:29.383544 IP localhost.56132 > localhost.1025: Flags [.], ack 1, win 342, options [nop,nop,TS val 3535512731 ecr 3535512731], length 0
17:59:29.383996 IP localhost.1025 > localhost.56132: Flags [P.], seq 1:36, ack 1, win 342, options [nop,nop,TS val 3535512731 ecr 3535512731], length 35
17:59:29.384027 IP localhost.56132 > localhost.1025: Flags [.], ack 36, win 342, options [nop,nop,TS val 3535512731 ecr 3535512731], length 0
17:59:29.384142 IP localhost.56132 > localhost.1025: Flags [P.], seq 1:17, ack 36, win 342, options [nop,nop,TS val 3535512731 ecr 3535512731], length 16
17:59:29.384165 IP localhost.1025 > localhost.56132: Flags [.], ack 17, win 342, options [nop,nop,TS val 3535512731 ecr 3535512731], length 0
17:59:29.384535 IP localhost.1025 > localhost.56132: Flags [P.], seq 36:57, ack 17, win 342, options [nop,nop,TS val 3535512732 ecr 3535512731], length 21
17:59:29.384627 IP localhost.1025 > localhost.56132: Flags [P.], seq 57:73, ack 17, win 342, options [nop,nop,TS val 3535512732 ecr 3535512731], length 16
17:59:29.384675 IP localhost.56132 > localhost.1025: Flags [.], ack 73, win 342, options [nop,nop,TS val 3535512732 ecr 3535512732], length 0
17:59:29.384714 IP localhost.1025 > localhost.56132: Flags [P.], seq 73:89, ack 17, win 342, options [nop,nop,TS val 3535512732 ecr 3535512732], length 16
17:59:29.384804 IP localhost.56132 > localhost.1025: Flags [P.], seq 17:52, ack 89, win 342, options [nop,nop,TS val 3535512732 ecr 3535512732], length 35
17:59:29.385120 IP localhost.1025 > localhost.56132: Flags [P.], seq 89:126, ack 52, win 342, options [nop,nop,TS val 3535512732 ecr 3535512732], length 37
17:59:29.385232 IP localhost.56132 > localhost.1025: Flags [P.], seq 52:85, ack 126, win 342, options [nop,nop,TS val 3535512732 ecr 3535512732], length 33
17:59:29.385524 IP localhost.1025 > localhost.56132: Flags [P.], seq 126:166, ack 85, win 342, options [nop,nop,TS val 3535512733 ecr 3535512732], length 40
17:59:29.385637 IP localhost.56132 > localhost.1025: Flags [P.], seq 85:91, ack 166, win 342, options [nop,nop,TS val 3535512733 ecr 3535512733], length 6
17:59:29.385904 IP localhost.1025 > localhost.56132: Flags [P.], seq 166:203, ack 91, win 342, options [nop,nop,TS val 3535512733 ecr 3535512733], length 37
17:59:29.386002 IP localhost.56132 > localhost.1025: Flags [P.], seq 91:119, ack 203, win 342, options [nop,nop,TS val 3535512733 ecr 3535512733], length 28
17:59:29.386055 IP localhost.56132 > localhost.1025: Flags [P.], seq 119:125, ack 203, win 342, options [nop,nop,TS val 3535512733 ecr 3535512733], length 6
17:59:29.386300 IP localhost.1025 > localhost.56132: Flags [P.], seq 203:283, ack 125, win 342, options [nop,nop,TS val 3535512733 ecr 3535512733], length 80
17:59:29.386618 IP localhost.1025 > localhost.56132: Flags [P.], seq 283:292, ack 125, win 342, options [nop,nop,TS val 3535512734 ecr 3535512733], length 9
17:59:29.386684 IP localhost.1025 > localhost.56132: Flags [F.], seq 292, ack 125, win 342, options [nop,nop,TS val 3535512734 ecr 3535512733], length 0
17:59:29.402455 IP localhost.1025 > localhost.56132: Flags [F.], seq 292, ack 125, win 342, options [nop,nop,TS val 3535512749 ecr 3535512733], length 0
17:59:29.402492 IP localhost.56132 > localhost.1025: Flags [.], ack 293, win 342, options [nop,nop,TS val 3535512750 ecr 3535512733,nop,nop,sack 1 {292:293}], length 0
17:59:29.586712 IP localhost.56134 > localhost.1025: Flags [S], seq 1039154250, win 43690, options [mss 65495,sackOK,TS val 3535512934 ecr 0,nop,wscale 7], length 0
17:59:29.586766 IP localhost.1025 > localhost.56134: Flags [S.], seq 257063140, ack 1039154251, win 43690, options [mss 65495,sackOK,TS val 3535512934 ecr 3535512934,nop,wscale 7], length 0
17:59:29.586816 IP localhost.56134 > localhost.1025: Flags [.], ack 1, win 342, options [nop,nop,TS val 3535512934 ecr 3535512934], length 0
17:59:29.587418 IP localhost.1025 > localhost.56134: Flags [P.], seq 1:36, ack 1, win 342, options [nop,nop,TS val 3535512934 ecr 3535512934], length 35
17:59:29.587463 IP localhost.56134 > localhost.1025: Flags [.], ack 36, win 342, options [nop,nop,TS val 3535512934 ecr 3535512934], length 0
17:59:29.587656 IP localhost.56134 > localhost.1025: Flags [P.], seq 1:17, ack 36, win 342, options [nop,nop,TS val 3535512935 ecr 3535512934], length 16
17:59:29.587679 IP localhost.1025 > localhost.56134: Flags [.], ack 17, win 342, options [nop,nop,TS val 3535512935 ecr 3535512935], length 0
17:59:29.588772 IP localhost.1025 > localhost.56134: Flags [P.], seq 36:57, ack 17, win 342, options [nop,nop,TS val 3535512936 ecr 3535512935], length 21
17:59:29.588862 IP localhost.1025 > localhost.56134: Flags [P.], seq 57:73, ack 17, win 342, options [nop,nop,TS val 3535512936 ecr 3535512935], length 16
17:59:29.588967 IP localhost.1025 > localhost.56134: Flags [P.], seq 73:89, ack 17, win 342, options [nop,nop,TS val 3535512936 ecr 3535512935], length 16
17:59:29.589122 IP localhost.56134 > localhost.1025: Flags [.], ack 89, win 342, options [nop,nop,TS val 3535512936 ecr 3535512936], length 0
17:59:29.589248 IP localhost.56134 > localhost.1025: Flags [P.], seq 17:52, ack 89, win 342, options [nop,nop,TS val 3535512936 ecr 3535512936], length 35
17:59:29.589616 IP localhost.1025 > localhost.56134: Flags [P.], seq 89:126, ack 52, win 342, options [nop,nop,TS val 3535512937 ecr 3535512936], length 37
17:59:29.589743 IP localhost.56134 > localhost.1025: Flags [P.], seq 52:85, ack 126, win 342, options [nop,nop,TS val 3535512937 ecr 3535512937], length 33
17:59:29.590115 IP localhost.1025 > localhost.56134: Flags [P.], seq 126:166, ack 85, win 342, options [nop,nop,TS val 3535512937 ecr 3535512937], length 40
17:59:29.590206 IP localhost.56134 > localhost.1025: Flags [P.], seq 85:91, ack 166, win 342, options [nop,nop,TS val 3535512937 ecr 3535512937], length 6
17:59:29.590467 IP localhost.1025 > localhost.56134: Flags [P.], seq 166:203, ack 91, win 342, options [nop,nop,TS val 3535512937 ecr 3535512937], length 37
17:59:29.590537 IP localhost.56134 > localhost.1025: Flags [P.], seq 91:119, ack 203, win 342, options [nop,nop,TS val 3535512938 ecr 3535512937], length 28
17:59:29.590602 IP localhost.56134 > localhost.1025: Flags [P.], seq 119:125, ack 203, win 342, options [nop,nop,TS val 3535512938 ecr 3535512937], length 6
17:59:29.590762 IP localhost.1025 > localhost.56134: Flags [P.], seq 203:283, ack 125, win 342, options [nop,nop,TS val 3535512938 ecr 3535512938], length 80
17:59:29.590913 IP localhost.1025 > localhost.56134: Flags [P.], seq 283:292, ack 125, win 342, options [nop,nop,TS val 3535512938 ecr 3535512938], length 9
17:59:29.590947 IP localhost.1025 > localhost.56134: Flags [F.], seq 292, ack 125, win 342, options [nop,nop,TS val 3535512938 ecr 3535512938], length 0
17:59:29.606457 IP localhost.1025 > localhost.56134: Flags [F.], seq 292, ack 125, win 342, options [nop,nop,TS val 3535512953 ecr 3535512938], length 0
17:59:29.606485 IP localhost.56134 > localhost.1025: Flags [.], ack 293, win 342, options [nop,nop,TS val 3535512954 ecr 3535512938,nop,nop,sack 1 {292:293}], length 0
17:59:29.791019 IP localhost.56136 > localhost.1025: Flags [S], seq 905916250, win 43690, options [mss 65495,sackOK,TS val 3535513138 ecr 0,nop,wscale 7], length 0
17:59:29.791041 IP localhost.1025 > localhost.56136: Flags [S.], seq 308581596, ack 905916251, win 43690, options [mss 65495,sackOK,TS val 3535513138 ecr 3535513138,nop,wscale 7], length 0
17:59:29.791059 IP localhost.56136 > localhost.1025: Flags [.], ack 1, win 342, options [nop,nop,TS val 3535513138 ecr 3535513138], length 0
17:59:29.791355 IP localhost.1025 > localhost.56136: Flags [P.], seq 1:36, ack 1, win 342, options [nop,nop,TS val 3535513138 ecr 3535513138], length 35
17:59:29.791369 IP localhost.56136 > localhost.1025: Flags [.], ack 36, win 342, options [nop,nop,TS val 3535513138 ecr 3535513138], length 0
17:59:29.791474 IP localhost.56136 > localhost.1025: Flags [P.], seq 1:17, ack 36, win 342, options [nop,nop,TS val 3535513138 ecr 3535513138], length 16
17:59:29.791480 IP localhost.1025 > localhost.56136: Flags [.], ack 17, win 342, options [nop,nop,TS val 3535513139 ecr 3535513138], length 0
17:59:29.792082 IP localhost.1025 > localhost.56136: Flags [P.], seq 36:57, ack 17, win 342, options [nop,nop,TS val 3535513139 ecr 3535513138], length 21
17:59:29.792191 IP localhost.1025 > localhost.56136: Flags [P.], seq 57:73, ack 17, win 342, options [nop,nop,TS val 3535513139 ecr 3535513138], length 16
17:59:29.792232 IP localhost.56136 > localhost.1025: Flags [.], ack 73, win 342, options [nop,nop,TS val 3535513139 ecr 3535513139], length 0
17:59:29.792378 IP localhost.1025 > localhost.56136: Flags [P.], seq 73:89, ack 17, win 342, options [nop,nop,TS val 3535513139 ecr 3535513139], length 16
17:59:29.792447 IP localhost.56136 > localhost.1025: Flags [P.], seq 17:52, ack 89, win 342, options [nop,nop,TS val 3535513139 ecr 3535513139], length 35
17:59:29.792828 IP localhost.1025 > localhost.56136: Flags [P.], seq 89:126, ack 52, win 342, options [nop,nop,TS val 3535513140 ecr 3535513139], length 37
17:59:29.792892 IP localhost.56136 > localhost.1025: Flags [P.], seq 52:85, ack 126, win 342, options [nop,nop,TS val 3535513140 ecr 3535513140], length 33
17:59:29.793346 IP localhost.1025 > localhost.56136: Flags [P.], seq 126:166, ack 85, win 342, options [nop,nop,TS val 3535513140 ecr 3535513140], length 40
17:59:29.793404 IP localhost.56136 > localhost.1025: Flags [P.], seq 85:91, ack 166, win 342, options [nop,nop,TS val 3535513140 ecr 3535513140], length 6
17:59:29.793827 IP localhost.1025 > localhost.56136: Flags [P.], seq 166:203, ack 91, win 342, options [nop,nop,TS val 3535513141 ecr 3535513140], length 37
17:59:29.793900 IP localhost.56136 > localhost.1025: Flags [P.], seq 91:119, ack 203, win 342, options [nop,nop,TS val 3535513141 ecr 3535513141], length 28
17:59:29.793926 IP localhost.56136 > localhost.1025: Flags [P.], seq 119:125, ack 203, win 342, options [nop,nop,TS val 3535513141 ecr 3535513141], length 6
17:59:29.793971 IP localhost.1025 > localhost.56136: Flags [.], ack 125, win 342, options [nop,nop,TS val 3535513141 ecr 3535513141], length 0
17:59:29.794164 IP localhost.1025 > localhost.56136: Flags [P.], seq 203:283, ack 125, win 342, options [nop,nop,TS val 3535513141 ecr 3535513141], length 80
17:59:29.794291 IP localhost.1025 > localhost.56136: Flags [P.], seq 283:292, ack 125, win 342, options [nop,nop,TS val 3535513141 ecr 3535513141], length 9
17:59:29.794316 IP localhost.1025 > localhost.56136: Flags [F.], seq 292, ack 125, win 342, options [nop,nop,TS val 3535513141 ecr 3535513141], length 0
17:59:29.794397 IP localhost.56136 > localhost.1025: Flags [.], ack 293, win 342, options [nop,nop,TS val 3535513141 ecr 3535513141], length 0
17:59:29.994702 IP localhost.56138 > localhost.1025: Flags [S], seq 3780532726, win 43690, options [mss 65495,sackOK,TS val 3535513342 ecr 0,nop,wscale 7], length 0
17:59:29.994738 IP localhost.1025 > localhost.56138: Flags [S.], seq 4165832483, ack 3780532727, win 43690, options [mss 65495,sackOK,TS val 3535513342 ecr 3535513342,nop,wscale 7], length 0
17:59:29.994771 IP localhost.56138 > localhost.1025: Flags [.], ack 1, win 342, options [nop,nop,TS val 3535513342 ecr 3535513342], length 0
17:59:29.995298 IP localhost.1025 > localhost.56138: Flags [P.], seq 1:36, ack 1, win 342, options [nop,nop,TS val 3535513342 ecr 3535513342], length 35
17:59:29.995341 IP localhost.56138 > localhost.1025: Flags [.], ack 36, win 342, options [nop,nop,TS val 3535513342 ecr 3535513342], length 0
17:59:29.995458 IP localhost.56138 > localhost.1025: Flags [P.], seq 1:17, ack 36, win 342, options [nop,nop,TS val 3535513342 ecr 3535513342], length 16
17:59:29.995475 IP localhost.1025 > localhost.56138: Flags [.], ack 17, win 342, options [nop,nop,TS val 3535513342 ecr 3535513342], length 0
17:59:29.995852 IP localhost.1025 > localhost.56138: Flags [P.], seq 36:57, ack 17, win 342, options [nop,nop,TS val 3535513343 ecr 3535513342], length 21
17:59:29.995948 IP localhost.1025 > localhost.56138: Flags [P.], seq 57:73, ack 17, win 342, options [nop,nop,TS val 3535513343 ecr 3535513342], length 16
17:59:29.996024 IP localhost.1025 > localhost.56138: Flags [P.], seq 73:89, ack 17, win 342, options [nop,nop,TS val 3535513343 ecr 3535513342], length 16
17:59:29.996122 IP localhost.56138 > localhost.1025: Flags [.], ack 89, win 342, options [nop,nop,TS val 3535513343 ecr 3535513343], length 0
17:59:29.996201 IP localhost.56138 > localhost.1025: Flags [P.], seq 17:52, ack 89, win 342, options [nop,nop,TS val 3535513343 ecr 3535513343], length 35
17:59:29.996572 IP localhost.1025 > localhost.56138: Flags [P.], seq 89:126, ack 52, win 342, options [nop,nop,TS val 3535513344 ecr 3535513343], length 37
17:59:29.996661 IP localhost.56138 > localhost.1025: Flags [P.], seq 52:85, ack 126, win 342, options [nop,nop,TS val 3535513344 ecr 3535513344], length 33
